manufactor,Year,model,Hand,Gear,capacity_Engine,Engine_type,Prev_ownership,Curr_ownership,Area,City,Price,Pic_num,Cre_date,Repub_date,Description,Color,Km,Test,Supply_score
קיה,2015,פיקנטו,2,אוטומטית,1248,בנזין,,,אילת והערבה,אילת,30000,1,13/08/2022,13/08/2022,"רכב שמור ,מטופל . טסט עד 02/23",,,,20
קיה,2016,ריו,3,אוטומטית,1400,בנזין,,,,כפר מצר,35000,1,13/08/2022,13/08/2022,רכב שמור מטופל במוסך מורשה לא חסר בורג טסט לחודש 4/23 &lt;br/&gt;&lt;br/&gt;פירוט:&lt;br/&gt; מערכת אנדרויד ומצלמת רוורס,,200,,15
קיה,2011,פורטה,2,אוטומטית,1600,בנזין,,,נתניה והסביבה,נתניה,21000,1,12/08/2022,12/08/2022,הרכב במצב שמור ומטופל. 4 דלתות ל-5 יושבים. תא מטען גדול. ליצור קשר עם דן.,,,,4
קיה,2012,,3,אוטומטית,1400,בנזין,,,,מג'ד אל-כרום,,1,08/08/2022,08/08/2022,,,160000,,0
קיה,2015,פיקנטו,3,אוטומטית,1200,בנזין,,,עמק יזרעאל,מגדל העמק,4000,1,07/08/2022,07/08/2022,רכב שמור נהגת יחידה,,130,,20
קיה,2015,פיקנטו,2,אוטומטית,1248,בנזין,,,,נהרייה,41000,1,02/08/2022,02/08/2022,רכב שמור פרטי מטופל ללא תאונה,,93000,,20
קיה,2016,אופטימה / Optima,1,אוטומטית,1600,בנזין,,,גליל ועמקים,נצרת,100000,1,31/07/2022,31/07/2022,"חדש בתצוגה ???? ג״פ קייה ספורטאז דגם: הכי מפואר premium GT נפח :1.6 (כ״ס177) שנת:2016 יד:01 פרטית ?? ק״ם :144,000 מטופל בחברה אוטו חדש ללא תיקון צבע מתחיב בבדיקה ? אפשרות למימון 100% ??0537550405 &lt;br/&gt;&lt;br/&gt;פירוט:&lt;br/&gt; וו גרירה",,145,,0
קיה,2013,פיקנטו,2,אוטומטית,1248,בנזין,,,פתח תקוה והסביבה,פתח תקווה,32500,1,30/07/2022,30/07/2022,"קיה פיקנטו, מודל 2013 רכב שמור (עם טיפולים מסודרים) טסט עד אפריל שנה הבאה. יד ראשונה היה השכרה/החכר (של הרץ). קניתי אותו שמור והבדיקה הכללית הייתה מצויינת. הוחלפו בשנה שעברה 4 צמיגים מקוריים. מולא גז מזגן לאחרונה, חשמל של חלונות הרכב (כולל פיקוד) - הוחלף בשנה שעברה. מצבר חדש - 21/22. * נא לא להתקשר בשבת * גמיש במידה ואני רואה שניתן להתקדם.",,175000,,11
קיה,2012,,2,ידנית,1000,בנזין,,,רמלה - לוד,רמלה,,1,25/07/2022,25/07/2022,,,190000,,0
קיה,2012,,2,ידנית,1000,בנזין,פרטית,פרטית,רמלה - לוד,רמלה,,5,24/07/2022,24/07/2022,,בז',,,0
קיה,2006,קארנס,5,אוטומטית,2000,בנזין,פרטית,פרטית,,איתמר,14000,10,21/07/2022,23/07/2022,"אחרי ראש מנוע לפני 6 ח' טיימינג+רצועות+מנוע תחתון נוסע סבבה, מחירון משוקלל 13576 ש""ח 6 מושבים 4 מרוחים 8 חגורות גם ברישיון(בתמונות) שורה אמצעית מתכוננת וזזה קדימה אחור מושבים מאחור לילדים,קיפול מושבים מאפשר שטח אעמסה,צריכת דלק מעולה1/15בנהיגה ח'1/12ברגיל,כשלוחצים 1/9 מזגן מקרר מעולה,ג'נטים מגנזיום,חלונות מושחרים, מצלמת רוורס,מצבר פחות משנה,שפע שקעים, מד דלק לא תקין,חלון ימין אחור עושה בעיות לפעמים תוספות אחרי ראש מנוע לפני 6 ח' טיימינג+רצועות+מנוע תחתון נוסע סבבה 8 חגורות גם ברישיון ג'נטים מגנזיום,חלונות מושחרים, מצלמת רוורס,מצבר פחות משנה",לבן,210000,,3
קיה,2012,ריו,2,אוטומטית,900,בנזין,,,,קריית אתא,20000,1,23/07/2022,23/07/2022,קיה מגניבה .מזגן מקפיא.נמכר עקב קבלת רכב מהעבודה,,230000,,9
קיה,2012,סראטו,1,אוטומטית,2000,בנזין,,,מושבים בשפלה,תימורים,51000,1,21/07/2022,21/07/2022,"ספורטז' פרימיום יד ראשונה ,שמור ומטופל,חישוקי מגנזיום,רפוד עור מלא,כפתור הנעה ,מולטימדיה. &lt;br/&gt;&lt;br/&gt;פירוט:&lt;br/&gt; וו גרירה.",,147000,,0
קיה,2005,קארנס,2,אוטומטית,1975,בנזין,,,,ראשו,10000,1,20/07/2022,20/07/2022,מצב מכני מעולה חלונות חשמל מערכת מולטימדיה מצלמת רוורס מתאים למשפחות .לא בשבת,,161000,,3
קיה,2008,ריו,4,אוטומטית,1400,בנזין,,,פתח תקוה והסביבה,פתח תקווה,6500,1,20/07/2022,20/07/2022,רכב מבחינה מכנית מעולה טסט עד שש עשרה לאוגוסט יש בעיה בבלמים חיצונית הצבע אכול ולכן הורדתי משמעותית במחיר,,199650,,5
קיה,2013,פורטה,2,אוטומטית,1600,בנזין,,,חולון - בת ים,חולון,30000,1,20/07/2022,20/07/2022,ללא תאונות במצב מצויין רכב מטופל אמין נוח וחסכוני &lt;br/&gt;&lt;br/&gt;פירוט:&lt;br/&gt; ללא תאונות במצב מצויין רכב מטופל אמין נוח וחסכוני,,160000,,6
קיה,2016,ריו,2,אוטומטית,1396,בנזין,,,אשדוד - אשקלון,אשדוד,35000,1,19/07/2022,19/07/2022,הרכב מטופל בזמן טסט עד 17/5/2023,,162127,,15
קיה,2000,פיקנטו,1,אוטומטית,1248,בנזין,,,גליל ועמקים,מעלות תרשיחא,73000,1,18/07/2022,18/07/2022,רכב שמור יד ראשונה מטופל במוסך קיה בכרמיאל. כל הקודם זוכה.,,32000,,0
קיה,2014,פיקנטו,2,אוטומטית,1248,בנזין,,,חיפה וחוף הכרמל,טירת כרמל,42000,1,18/07/2022,18/07/2022,רכב. במצב מצויין מטופל בזמן יד פרטית,,101500,,14
קיה,2015,סראטו,3,אוטומטית,1591,בנזין,,,אילת והערבה,אילת,70000,1,18/07/2022,18/07/2022,"מוכרת את אהובת ליבי עקב מעבר לחו״ל קיה ספורטאג (דגם ישן) 2015 נפח מנוע - 1591 כ״ס - 133 יד 3 (לא מסוכנות רק פרטי) אוטו שקיבל רק אהבה , טיפולים תמיד בזמן , חנה רק בחניה מוצלת , אביזרים נלווים (ממותגי קיה) . קילומטראז - 110,000 גלגלים- חדשים טסט - טסט לשנה מרגע המכירה!!! מזגן - שלא מבייש את הקיץ באילת (מקפיא !!) מצלמת רוורס , מערכת מולטימדיה , רמקולים נדירים, מחיר - 70,000 (גמישה לרציניים!!!) מוכרת את האוטו ב8.9.22 עם טסט לשנה עד 09/23 שוב האוטו שמור ביותר אם הייתי יכולה הייתי לוקחת אותו איתי לחו״ל אך לצערי…..",,110000,,0
קיה,2015,ריו,2,אוטומטית,1400,בנזין,,,ירושלים והסביבה,ביתר עילית,29000,1,18/07/2022,18/07/2022,"רכב במצב מעולה , צמיגים חדשים , מצבר חדש , טסט עד ה 5.23 , גמישה במחיר לרציניים. &lt;br/&gt;&lt;br/&gt;פירוט:&lt;br/&gt; מוביליי ,מערכת מולטימדיה , מצלמת רוורס",,200000,,18
קיה,2015,ריו,2,אוטומטית,1400,בנזין,,,חולון - בת ים,חולון,29000,1,16/07/2022,16/07/2022,רכב שמור ללא תאונות במצב מצויין עם מערכת מולטימדיה מצלמת רוורס ומערכת מוביליי חסכוני אמין ונוח &lt;br/&gt;&lt;br/&gt;פירוט:&lt;br/&gt; רכב שמור ללא תאונות במצב מצויין עם מערכת מולטימדיה מצלמת רוורס ומערכת מוביליי חסכוני אמין ונוח,,170000,,18
קיה,2016,פיקנטו,2,אוטומטית,1250,בנזין,,,חולון - בת ים,חולון,39000,1,16/07/2022,16/07/2022,במצב מעולה ללא תאונות רכב שמור מאוד ומטופל בזמן לאחר טיפול התחייבות בבדיקה אמין חסכוני ונוח &lt;br/&gt;&lt;br/&gt;פירוט:&lt;br/&gt; במצב מעולה ללא תאונות רכב שמור מאוד ומטופל בזמן לאחר טיפול התחייבות בבדיקה אמין חסכוני ונוח,,99000,,24
קיה,2015,פיקנטו,1,אוטומטית,1248,בנזין,,,חולון - בת ים,חולון,40000,1,16/07/2022,16/07/2022,רכב שמור במצב נדיר! ללא תאונות!,,87000,,20
קיה,2011,פורטה,3,אוטומטית,1600,בנזין,,,חולון - בת ים,חולון,19500,1,12/07/2022,12/07/2022,רכב נוסע נסיעה נקייה ללא תקלות מכניות,,165000,,4
קיה,2016,,1,אוטומטית,1250,בנזין,,,פתח תקוה והסביבה,פתח תקווה,,1,08/07/2022,08/07/2022,,,51000,,0
קיה,2013,ריו,2,אוטומטית,1400,בנזין,,,"ראשל""צ והסביבה",ראשון לציון,26900,1,08/07/2022,08/07/2022,"לבוא לקחת. התחייבות לקנייה חוזרת עד 5 שנים. שקיפות מלאה!!! מגוון אפשרויות מימון עד 100% כולל תשלום בצקים. נמצא בסוכנות ""גרינקאר"" בראשל""צ, רח' הרצל 28. הנחות ומחירים מיוחדים יינתנו בסניף, יחס אישי לכל לקוח שקיפות מלאה!!! מבחר ענק של רכבים נוספים ניתן לראות באתר של גרינקאר. לצאת עם רכב חדש באותו היום.",,,,10
קיה,2015,פיקנטו,3,אוטומטית,1250,בנזין,,,נתניה והסביבה,נתניה,43000,1,04/07/2022,04/07/2022,"מנוע 1250 אוטומט, לא היה בהשכרה או ליסינג. פרטי לחלוטין, שמור אין אף תיקון צבע.",,115000,,20
קיה,2014,פיקנטו,3,אוטומטית,1250,בנזין,,,נס ציונה - רחובות,רחובות,40000,1,30/06/2022,30/06/2022,רכב מעולה אמין נוסע טוב וחלק. שמו מאוד מאוד. מטופל כמו שצריך שמנין פילטרים וברקסים חדשים יחסית. הכל באמת ממד שמור וטוב לרציניים גמיש קצת במחיר &lt;br/&gt;&lt;br/&gt;פירוט:&lt;br/&gt; מערכת מולטימדיה ריפודים יפים ונוחים ממש אנטנת כריש,,100000,,14
קיה,2016,פיקנטו,1,אוטומטית,1248,בנזין,,,יישובי השומרון,ברקן,45000,1,27/06/2022,27/06/2022,דגם מפואר סוף שנת 2016 . טסט עד 01/2023. גג נפתח . רכב במצב מצויין . מטופל כל 10-15 אלף קילומטרז. &lt;br/&gt;&lt;br/&gt;פירוט:&lt;br/&gt; משענת יד . תאורת לד פנימית .,,35000,,24
קיה,2015,פיקנטו,1,אוטומטית,1250,בנזין,,,"ראשל""צ והסביבה",ראשון לציון,43500,1,20/06/2022,20/06/2022,"רכב שמור ללא תאונות ,אחרי טיפול וצמיגים, בהזדמנות!",,57000,,20
קיה,2016,פיקנטו,2,אוטומטית,1250,בנזין,,,חולון - בת ים,חולון,40000,1,19/06/2022,19/06/2022,ללא תאונות במצב מעולה רכב מטופל ושמור עם מערכת מולטימדיה מצלמת רוורס חיישני רוורס התחייבות בבדיקה &lt;br/&gt;&lt;br/&gt;פירוט:&lt;br/&gt; ללא תאונות במצב מעולה רכב מטופל ושמור עם מערכת מולטימדיה מצלמת רוורס חיישני רוורס התחייבות בבדיקה,,73000,,24
קיה,2011,פיקנטו,3,אוטומטית,1248,בנזין,,,"ראשל""צ והסביבה",ראשון לציון,23000,1,18/06/2022,18/06/2022,צבע חום מולטימדיה חדשה באחריות צמיגים חדשים,,170000,,3
קיה,2011,סול,2,טיפטרוניק,1600,דיזל,,,באר שבע והסביבה,שדרות,32000,1,15/06/2022,15/06/2022,קיה סול טורבו דיזל 1600 רכב חסכוני ומרווח &lt;br/&gt;&lt;br/&gt;פירוט:&lt;br/&gt; וו גרירה ששומש לטיולים עם עגלה קטנה מדי פעם מערכת מולטימדיה עם מצלמת רוורס של פיוניר,,182000,,6
קיה,2015,פיקנטו,2,אוטומטית,1299,בנזין,,,מושבים בשרון,עין ורד,48000,1,14/06/2022,14/06/2022,"רכב קומפקטי, שמור מאוד וחסכוני, ללא תאונות כלל עם קילומטראז' נמוך וטסט לשנה. *בובה של רכב, מחליף אך ורק בגלל קבלת רכב מהעבודה!!! &lt;br/&gt;&lt;br/&gt;פירוט:&lt;br/&gt; כל התוספות המקוריות מהחברה - פנסי לד קדמיים ואחוריים, גג נפתח חשמלי, 2 אגזוזים, חישוקי מגנזיום, קודנית מקורית קיה, חיישני רוורס ו-מובילאיי (מתברר שזה חוסך לא מעט בבביטוח הרכב)",,93000,,20
קיה,2012,פיקנטו,1,אוטומטית,1248,בנזין,,,"ראשל""צ והסביבה",ראשון לציון,37000,1,13/06/2022,13/06/2022,שמור,,70000,,4
קיה,2016,פיקנטו,1,אוטומטית,1248,בנזין,,,ראש העין והסביבה,אלעד,40000,1,13/06/2022,13/06/2022,חלון גגנפתח. נהג יחיד.שמורה. &lt;br/&gt;&lt;br/&gt;פירוט:&lt;br/&gt; מולטימדיה.אמובייל. טסט עד סוף מרץ 2,,87000,,24
קיה,2012,פיקנטו,2,אוטומטית,1248,בנזין,,,נתניה והסביבה,נתניה,30000,1,05/06/2022,05/06/2022,קיה LX רכב אמין וחסכוני במצב מכני מעולה. מטופל בזמן במוסך מורשה טסט לחצי שנה,,153000,,4
קיה,2014,פיקנטו,1,ידנית,1000,בנזין,פרטית,פרטית,חדרה וישובי עמק חפר,אחיטוב,24900,3,26/03/2022,02/06/2022,"לא עבר תאונות, נראה טוב ומטופל היטב, רכב זריז מאד וקל לנהיגה, שומר היטב על ערכו תוספות בלמים חדשים, מצבר חדש עם אחריות, צמיגים בני שנה, פילטר מזגו חדש",אדום,127000,,14
קיה,2016,פיקנטו,2,אוטומטית,1248,בנזין,,,אשדוד - אשקלון,אשדוד,50000,1,31/05/2022,31/05/2022,"קיה פיקנטו הדגם המבוקש TOP אוט' + חלון גג מקורי 1.2 שנת 2016, אוטומטית, 1248 סמ""ק, יד שנייה מפרטי נהגת יחידה, רכב חונה בחנייה מקורה בלבד, שמור מאוד, נקי, מטופח ומטופל בזמן !! חסכוני בדלק ברמה מטורפת!!!! * טסט עד ה- 04/23 * הותקנה מצלמת רוורס ומצלמת דרך * התחייבות למנוע, גיר ושילדה * כולל מסך מולטימדיה ומובילאיי",,81000,,24
קיה,2015,פיקנטו,2,אוטומטית,1248,בנזין,,,רעננה - כפר סבא,כפר סבא,38500,1,24/05/2022,24/05/2022,"שמור, 2 גלגלים חדשים, טסט לשנה, עבר טיפול לאחרונה. רכב אמין, חסכוני בדלק, זריז ונוח.",,115000,,20
קיה,2014,פיקנטו,3,אוטומטית,1200,בנזין,פרטית,פרטית,מודיעין והסביבה,מודיעין,31000,9,21/05/2022,21/05/2022,"רכב שמור ומטופל, נוסע מעולה, מזגן מקפיא, מולטימדיה, חיישני רוורס, מגנזיום, נקי מתאונות, מאשה מבוגרת שש שנים. טסט ל10 חודשים מחיר מתחת למחירון תוספות דגם EX מאובזר",בז',180000,,14
קיה,2015,פיקנטו,1,אוטומטית,1200,בנזין,,,תל אביב,תל אביב יפו,48000,1,15/05/2022,15/05/2022,פיקנטו ספורט 2015 במצב מדהים!! יד ראשונה עם סאנרוף,,50000,,20
קיה,2016,פיקנטו,3,אוטומטית,1250,בנזין,,,חולון - בת ים,חולון,40000,1,12/05/2022,12/05/2022,רכב במצב חדש ללא תאונות מטופל בזמן טסט לשנה כולל טיפול &lt;br/&gt;&lt;br/&gt;פירוט:&lt;br/&gt; רכב במצב חדש ללא תאונות מטופל בזמן טסט לשנה כולל טיפול,,70000,,24
קיה,2012,פיקנטו,2,אוטומטית,1250,בנזין,,,מודיעין והסביבה,שוהם,31000,1,11/05/2022,11/05/2022,"קאיה פיקנטו ממש חדשה 2012/09 אוטומטית לחלוטין חלונות חשמל נעילה מרכזית חסכוני זריז וממש מוצלח דגם הדגל של פיקנטו EX ללא תאונות יד 02 ""מתקרבים ליומלדת 120 אלף קמ"" עדיין, 119874 ק""מ של הנאות התחיבות מלאה בבדיקה ! מצבר חדש בעלות פרטית לגמרי מצלמת דרך איכותית AUX/BT/USB יש עוד נלווים וכל מיני תוספות ואיבזרים שזה להנאת הקונה החדש לבריאות מושקעת בכל טוב מחנה בחנייה מקורה פיקנטיי שירתה אותנו בהנאה ושלווה ובנחת 5 שנים למרות שזה רכב נדיר הוחלט שעוברים לרכב משפחתי יותר 7 מקומות/גיפ/קרוסאוובר 4 צמיגים חדשים הכל עובד על פי חיישנים בדגם הזה,האורות,הווישירים, טיפול גדול לפני מספר שבועות מצורפת ניירת גמיש לרצינים בלבד ולמי שבאמת מגיע לו כזה רכב ! אני דורש 30 גמיש מעט לריצינים &lt;br/&gt;&lt;br/&gt;פירוט:&lt;br/&gt; רכב יפייפיה,",,119874,,4
קיה,2015,פיקנטו,3,אוטומטית,1248,בנזין,,,ירושלים והסביבה,ירושלים,38000,1,06/05/2022,06/05/2022,מצב מצויין וחיסכוני,,99000,,20
קיה,2012,ריו,2,אוטומטית,1399,בנזין,,,גדרה יבנה והסביבה,כפר מרדכי,16000,1,03/05/2022,03/05/2022,רכב שמור במיוחד,,465000,,9
קיה,2014,פורטה,2,אוטומטית,1600,בנזין,,,ירושלים והסביבה,ירושלים,34000,1,29/04/2022,29/04/2022,"נקנתה מאלבר כחדשה 0 ק""מ ללא תאונות במצב טוב ומטופלת מחירון 38000 דורש 34000 (הפחתה ליסינג)",,141600,,9
קיה,2015,פיקנטו,1,אוטומטית,1250,בנזין,,,מושבים בשרון,אודים,42000,1,21/04/2022,21/04/2022,"שירת אותי נאמנה נהגת יחידה , במצב מעולה - דגם מפואר EX",,119000,,20
קיה,2014,פיקנטו,2,אוטומטית,1250,בנזין,,,"ראשל""צ והסביבה",ראשון לציון,42000,1,20/04/2022,20/04/2022,"רכב שמור במצב מצויין ומטופל בזמן, יד שנייה עם 73,000 ק""מ מצבר חדש עם אחריות, נעשה טיפול שנתי, וטסט לשנה. עלייה לכביש 04/2014, שימש לנסיעות קצרות בלבד. מערכת מולטימדיה, סאנרוף, ג'נטים מגנזיום, מצלמה וחיישני רוורס. נמכר עקב התרחבות המשפחה לא בשבת",,73000,,14
קיה,2013,סיד,2,רובוטית,1600,בנזין,השכרה,פרטית,פרדס חנה - כרכור,קציר,30000,2,06/04/2022,06/04/2022,"רכב משפחתי מפנק גדול ומרווח, נקנה ב2017 מחברת באדג'ט ומאז משרת אותנו נאמנה. טיפולים תקופתיים ותחזוקה לפי הספר. הרכב נמכר עקב קבלת רכב חברה",לבן,180000,,16
קיה,2011,סיד,2,אוטומטית,1600,בנזין,ליסינג,פרטית,ראש העין והסביבה,ראש העין,20500,1,18/03/2022,18/03/2022,"טסט ארוך, 196 קילומטרז",לבן,,,13
קיה,2013,פיקנטו,2,אוטומטית,1300,בנזין,פרטית,פרטית,פתח תקוה והסביבה,פתח תקווה,35000,1,02/03/2022,02/03/2022,"רכב שמור יד שנייה +חיישני רוורס 105550 ק""מ .ידיים -פרטיות טסט לעוד 7 חודשים.",כסוף,105550,,11
קיה,2016,פיקנטו,1,אוטומטית,1000,בנזין,השכרה,השכרה,רעננה - כפר סבא,רעננה,25000,3,10/11/2023,10/11/2023,"רכב שמור מטופל ,ללא תאונות ,יד ראשונה ישירות מחברת ההשכרה",כסוף מטאלי,155000,,24
קיה,2008,קרניבל,3,אוטומטית,2700,בנזין,השכרה,פרטית,חיפה וחוף הכרמל,חיפה,17000,3,11/02/2022,11/02/2022,"רכב משפחתי, 7 מקומות, 141400 ק""מ, טסט עד סוף יוני.",בורדו,141400,,8
קיה,2015,,1,אוטומטית,2000,בנזין,פרטית,פרטית,נתניה והסביבה,נתניה,,5,08/01/2022,08/01/2022,,אפור מטאלי,117000,,0
קיה,2016,פיקנטו,2,אוטומטית,1200,בנזין,פרטית,פרטית,,בית ג'ן,1,5,10/12/2021,10/12/2021,✅ יצרן : קיה ✅ דגם : פיקנטו ✅ נפח : 1248 ✅הספק (כ״ס):84 ✅ שנה: 2016 ✅ ת. הילוכים : אוטו ✅ יד: 02 ✅ בעלות : פרטית ✅ סוג מנוע : בנזין ✅ טסט עד: 03/2022 ✅ ק״מ 167.000 ✅ צבע הרכב : לבן תוספות ❤️Kia Picanto ❤️ ❤️מכונית מיני עירוני ומאוד פופלארית ❤️ 💛נראית מצוין מרגישה איכותית ובוגרת 💛 ❤️מרווח פנימי קלאסי ותא מטען גדל במעט❤️ 💛פיקנטו לא מרגישה קטנה כפי שהיא באמת 💛 ❤️מימון 💯% ☎️ לפרטים חייגו054-7366282/052-5992525 🏠כתובתנו: בית הרכב בית גאן🚘 קישור בwaze״ https://waze.com/ul/hsvc5sbrvr 😊והגיעו להתרשם.😊 🥰 נשמח לשיתופים🥰,לבן,167000,,24
קיה,2016,פיקנטו,1,אוטומטית,1300,בנזין,פרטית,פרטית,ירושלים והסביבה,ירושלים,38000,1,01/12/2021,01/12/2021,רכב מצב מצויין! 132 אלף קלימוטר הושקע ברכב המון כל טיפול בוצע בזמן! כל הקודם זוכה!! תוספות מערכת מולטימדייה חדשה,אפור עכבר,132,,24
קיה,2007,קרניבל,7,אוטומטית,2900,דיזל,פרטית,פרטית,ירושלים והסביבה,ירושלים,25500,6,03/11/2021,16/11/2021,"רכב חזק, יפה, נוח, שמור, 7 מקומות מרווחים למבוגרים, מולטימדיה ענק, מצלמת רוורס. פשוט מלך על הכביש",תכלת מטאלי,255,,6
קיה,2013,פיקנטו,3,ידנית,1200,בנזין,פרטית,פרטית,טבריה והסביבה,מגאר,22000,3,11/09/2021,29/09/2021,"נסע 155 אלף יד 02 מצב חדש, ממיר קטליטי חדש טיפול גדול כולל פלגים ופלטירים, מסך אנדרויד ,מבפנים כמו חדש ,קויל חדש , רכב חסכוני מאוד ,צמיגים חדשים .חייב להימכר",אדום מטאלי,155000,,11
קיה,2008,סיד,3,אוטומטית,1600,בנזין,ליסינג,פרטית,חולון - בת ים,חולון,9000,4,14/06/2021,25/07/2021,RFC ANUR NTUS,לבן,205000,,6
קיה,2014,פיקנטו,3,אוטומטית,1300,בנזין,ליסינג,ליסינג,גליל ועמקים,שפרעם,35,4,30/08/2023,30/08/2023,רכב אלעלאא שפרעם תוספות ..,זהב,150000,,14
קיה,2009,סראטו,3,אוטומטית,1600,בנזין,,,חולון - בת ים,חולון,1800,0,31/10/2022,31/10/2022,הרכב במצב טוב ללא טסט וביטוח קיבלנו רכב חדש יותר מההורים ולחן הוא מוצע למכירה,,167000,,0
קיה,2011,קרניבל,3,אוטומטית,2200,דיזל,,,"ראשל""צ והסביבה",ראשון לציון,33000,0,29/10/2022,29/10/2022,רכב מעולה 7 נוסעים ניראה כמו חדש נוסע מצוין מתאים למישפחה גדולה,,165000,,2
קיה,2015,ג`ויס,3,אוטומטית,2000,בנזין,,,תל אביב,תל אביב יפו,,0,27/10/2022,27/10/2022,שמעון הצגת מספר טלפון,,147000,,0
קיה,2016,נירו EV,2,אוטומטית,1600,בנזין,,,גליל ועמקים,צפת,80000,0,13/10/2022,13/10/2022,"אוטו שמור ,מרווח מאד .",,113000,,0
קיה,2016,פיקנטו,1,אוטומטית,1248,בנזין,,,חולון - בת ים,חולון,52950,0,02/10/2022,02/10/2022,"קיה פיקנטו מודל טופ (גג נפתח). מועד עלייה לכביש 10/2016. שמורה כחדשה, רק 55,000 ק""מ, נהגת יחידה. הרכב טופל רק במוסך מורשה וכל הטיפולים מתועדים בספר טיפולים. &lt;br/&gt;&lt;br/&gt;פירוט:&lt;br/&gt; מגיני גשם, אימוביליי",,55000,,24
קיה,2015,ספיה,1,אוטומטית,1600,בנזין,,,מושבים בשרון,תנובות,73000,0,29/09/2022,29/09/2022,"מציאה - גיפון קייה ספורטג' שנת 2015, שמורה קילומטר נמוך רק 62000 ,טסט לשנה עד 2/9/23 , מטופלת לא בשבת &lt;br/&gt;&lt;br/&gt;פירוט:&lt;br/&gt; מערכת שמע דיוידי 9,",,62000,,0
קיה,2011,פיקנטו,3,אוטומטית,1250,בנזין,,,רעננה - כפר סבא,רעננה,30000,0,29/09/2022,29/09/2022,קיה פיקנטו שנת 2011 יד 3 פרטית (02) ברישיון כל הידיים פרטיות נמכר עקב התרחבות המשפחה 152 אלף קילומטר 0542635580 &lt;br/&gt;&lt;br/&gt;פירוט:&lt;br/&gt; מסך מולטימדיה ומצלמת רוורס,,152000,,3
קיה,2012,סול,2,אוטומטית,1600,בנזין,,,"ראשל""צ והסביבה",ראשון לציון,27800,0,25/09/2022,25/09/2022,רכב שמור ומטופל.,,102000,,5
