manufactor,Year,model,Hand,Gear,capacity_Engine,Engine_type,Prev_ownership,Curr_ownership,Area,City,Price,Pic_num,Cre_date,Repub_date,Description,Color,Km,Test,Supply_score
קיה,2015,ספיה,2,אוטומטית,1600,בנזין,,,מושבים בשרון,תנובות,74000,0,24/09/2022,24/09/2022,"מציאה קיה ספורטג שמורה מאוד מעט קילומטר, טסט לשנה, &lt;br/&gt;&lt;br/&gt;פירוט:&lt;br/&gt; דיוידי חדש 9",,62000,,0
קיה,2015,ספיה,2,אוטומטית,1600,בנזין,,,מושבים בשרון,תנובות,74000,0,24/09/2022,24/09/2022,"מציאה קיה ספורטג שמורה מאוד מעט קילומטר, טסט לשנה, &lt;br/&gt;&lt;br/&gt;פירוט:&lt;br/&gt; דיוידי חדש 9",,62000,,0
קיה,2016,סראטו,1,אוטומטית,2359,טורבו דיזל,,,רמת גן - גבעתיים,בני ברק,139000,0,15/09/2022,15/09/2022,"רכב שמור מאד, מפנק, מושקע, נח, יציב על הכביש, שקט ועוצמתי, גג פנורמי נפתח, מושבי עור, מערכת מולטימדיה מובנית עם מסך מגע ווויז מובנה, מצלמות רוורס וחיישנים היקפיים מובנים, 7 מקומות ישיבה, מזגן חזק גם מאחורה, גמיש במחיר, לא בשבת. &lt;br/&gt;&lt;br/&gt;פירוט:&lt;br/&gt; מערכת מולטימדיה מובנית עם מסך מגע ווויז מובנה, מצלמות רוורס וחיישנים היקפיים מובנים",,112000,,0
קיה,2014,פיקנטו,3,אוטומטית,1250,בנזין,,,"ראשל""צ והסביבה",ראשון לציון,40000,0,15/09/2022,15/09/2022,קיה פיקנטו שנת 2014 נסעה 86 אלף קילומטר יד שלישית הרכב עבר טסט יש מערכת מולטימדיה רכב שמור!,,86000,,14
קיה,2012,פורטה,2,אוטומטית,1600,בנזין,,,הוד השרון והסביבה,הוד השרון,20000,0,06/09/2022,06/09/2022,גיא הצגת מספר טלפון,,,,2
קיה,2014,פיקנטו,2,אוטומטית,1250,בנזין,,,רמת גן - גבעתיים,רמת גן,35000,0,05/09/2022,05/09/2022,"למכירה קיה פיקנטו 2014 LX אוטומט. שמורה מצב מעולה ללא תאונות ללא תקלות. מנוע גיר שלדה תקינים. טיפולים שגרתיים בזמן בקביעות. שימשה אותי נאמנה כמה שנים יפות וזקוק לרכב גדול יותר. יד שנייה, קילומטרז': 144,000 מחיר: 35,000. לרציניים גמיש במחיר. מאזור רמת גן. זמין בפרטי או בטלפון 0546863710",,144000,,14
קיה,2016,,3,אוטומטית,1800,דיזל,מונית,פרטית,גליל ועמקים,נצרת,,6,25/03/2022,25/03/2022,,לבן פנינה,300000,,0
קיה,2006,קרניבל,2,אוטומטית,2000,דיזל,,,תל אביב,תל אביב יפו,15000,0,31/08/2022,31/08/2022,קיה קרניבל 2006 - נמכר עקב שדרוג ל2022. יש המון תמונות בוואטסאפ. &lt;br/&gt;&lt;br/&gt;פירוט:&lt;br/&gt; מאובזר מאד מאד.,,,,4
קיה,2011,ריו,3,אוטומטית,1399,בנזין,,,יישובי השומרון,רבבה,19000,0,26/08/2022,26/08/2022,רכב במצב מצוין. אחרי טיפול. טסט לשנה.,,165000,,4
קיה,2010,ריו,3,ידנית,1500,דיזל,,,,ג'ולס,2000,0,23/08/2022,23/08/2022,&lt;br/&gt;&lt;br/&gt;פירוט:&lt;br/&gt; רכב לחלקים מנוע גיר תקין,,300000,,6
קיה,2013,פיקנטו,2,אוטומטית,1250,בנזין,,,אשדוד - אשקלון,אשדוד,36000,0,22/08/2022,22/08/2022,גלי אלכס הצגת מספר טלפון,,137000,,11
קיה,2015,פיקנטו,1,אוטומטית,125,בנזין,,,יישובי השומרון,שערי תקווה,44000,0,22/08/2022,22/08/2022,רכב במצב מעולה! ללא תאונות וכו,,100000,,20
קיה,2015,פיקנטו,2,ידנית,1000,בנזין,,,,בית אל ב',,0,10/08/2022,10/08/2022,"רכב שמור, הילוכים, חסכוני מאד.",,140624,,20
קיה,2016,פרייד,1,אוטומטית,1591,בנזין,,,עמק יזרעאל,קרית טבעון,94000,0,28/07/2022,28/07/2022,הרכב נסע 100 אלף 2016 נסעה אשה 4 שנים עם הרכב הרכב מיאוד שמור אני מתכיב בבדיקה גיר מנוע שילדה הרכב דגם gt הדגם המפואר,,105000,,0
קיה,2014,אופטימה / Optima,1,אוטומטית,1700,דיזל,,,"ראשל""צ והסביבה",ראשון לציון,15000,0,23/07/2022,23/07/2022,הרכב הינו מונית לשעבר הפכתי את האוטו לרכב פרטי הרכב היה מטופל בזמן עבר שיפוץ גיר ליפני שנה מצב הפחחות טוב מאוד,,380000,,0
קיה,2016,פיקנטו,3,אוטומטית,1250,בנזין,,,"ראשל""צ והסביבה",ראשון לציון,29900,0,07/07/2022,07/07/2022,"לבוא לקחת. התחייבות לקנייה חוזרת עד 5 שנים. שקיפות מלאה!!! מגוון אפשרויות מימון עד 100% כולל תשלום בצקים. נמצא בסוכנות ""גרינקאר"" בראשל""צ, רח' הרצל 28. הנחות ומחירים מיוחדים יינתנו בסניף, יחס אישי לכל לקוח שקיפות מלאה!!! מבחר ענק של רכבים נוספים ניתן לראות באתר של גרינקאר. לצאת עם רכב חדש באותו היום.",,,,24
קיה,2015,פורטה,1,אוטומטית,1600,בנזין,,,מושבים בשרון,תנובות,73000,0,07/07/2022,07/07/2022,"קיה ספורטאג שמורה במצב מעולה, של פנסיונרית, שנוסעת מעט, אחרי כל הטיפולים, שווה מאוד, לא בשבת &lt;br/&gt;&lt;br/&gt;פירוט:&lt;br/&gt; החלפתי מרדיו דיסק , למערכת ויודי גודל 9 גדולה, יש מערכת רברס, יש כספת שנקנתה שהותקנה",,60000,,6
קיה,2012,פיקנטו,1,ידנית,1000,בנזין,פרטית,פרטית,אשדוד - אשקלון,אשדוד,18200,0,27/06/2022,26/06/2022,אחלה אוטו קטן חסכוני. 00בעלים קודמים,ירוק בהיר,169500,,4
קיה,2014,פיקנטו,1,אוטומטית,1200,בנזין,,,חולון - בת ים,חולון,34000,0,18/06/2022,18/06/2022,שמיר נהג יחיד מטופל במוסך קיה,,160,,14
קיה,2015,פיקנטו,3,ידנית,1000,בנזין,,,עמק יזרעאל,עפולה,20000,0,15/06/2022,15/06/2022,טסט לשנה צמיגים חדשים שמור,,,,20
קיה,2012,קרניבל,3,אוטומטית,2900,דיזל,,,"ראשל""צ והסביבה",ראשון לציון,35000,0,11/06/2022,11/06/2022,רכב 7 נוסעים עים טסט 10 חודשים לאחר חידוש כללי ממש מציאה,,144000,,1
קיה,2008,סראטו,2,אוטומטית,1600,בנזין,,,ירושלים והסביבה,ירושלים,12500,0,25/05/2022,25/05/2022,רכב שמור מנוע חזק,,170000,,0
קיה,2016,,1,אוטומטית,1600,היבריד,פרטית,פרטית,,יערה,,1,16/11/2021,16/11/2021,,טורקיז,204000,,0
קיה,2016,ספיה,1,אוטומטית,1600,בנזין,,,מושבים בשרון,תנובות,75000,0,09/05/2022,09/05/2022,"גיפון קיה ספורטג מציאה,שמורה מאוד, טאס עד 2023, טיפול 10,000, מצבר חדש, בלמים, גלגלי חדשים, נוסעת מעט איתה, כי אני בפנסיה , אך מפנקת אותה ומשגדרגת כול הזמן, כול הקודם זוכה &lt;br/&gt;&lt;br/&gt;פירוט:&lt;br/&gt; כספת לביטוח, מערכת חדשה גודל 9,שמורה מאוד , כולל כול הטיפולים",,60000,,0
קיה,2015,פורטה,1,אוטומטית,1600,בנזין,פרטית,פרטית,,חורה,37000,0,15/11/2021,15/11/2021,רכב בהזדמנות נדירה,לבן,87500,,6
